{
  "architecture_profile_ref": {
    "digest": "sha256:dcac9d4c519c7624b74ba6f9e5b878b17553c828b6d6d8583754c34c6a2e4807",
    "id": "five-layer-baseline",
    "version": "1"
  },
  "calculation_run_id": "018f0f5e-7b5e-7b2d-9f0b-7f66c2a88a01",
  "component_assignments": [
    {
      "assignment_id": "assignment.archive-storage",
      "capability_evidence": [
        "capability.archive-storage"
      ],
      "cost_contribution": {
        "currency": "USD",
        "monthly_amount": "1"
      },
      "deployment_component_id": "deployment.azure.archive-storage",
      "deployment_component_version": "1",
      "deployment_specification_component_ids": [
        "l3_archive.azure.blob_storage"
      ],
      "formula_refs": [
        "formula.archive-storage"
      ],
      "logical_component_id": "component.archive-storage",
      "pricing_model_refs": [
        "pricing.azure.archive-storage"
      ],
      "provider": "azure",
      "provider_implementation_profile_ref": {
        "digest": "sha256:2ba5943a139f846d25e2f4974051fa20775b6a096beda87fd3fc8cb44f1ce614",
        "id": "provider-profile.azure.baseline",
        "version": "1"
      },
      "region": "westeurope",
      "required": true,
      "responsibility_id": "responsibility.storage",
      "service_id": "azure.archive-storage"
    },
    {
      "assignment_id": "assignment.cool-storage",
      "capability_evidence": [
        "capability.cool-storage"
      ],
      "cost_contribution": {
        "currency": "USD",
        "monthly_amount": "1"
      },
      "deployment_component_id": "deployment.azure.cool-storage",
      "deployment_component_version": "1",
      "deployment_specification_component_ids": [
        "l3_cool.azure.blob_storage"
      ],
      "formula_refs": [
        "formula.cool-storage"
      ],
      "logical_component_id": "component.cool-storage",
      "pricing_model_refs": [
        "pricing.azure.cool-storage"
      ],
      "provider": "azure",
      "provider_implementation_profile_ref": {
        "digest": "sha256:2ba5943a139f846d25e2f4974051fa20775b6a096beda87fd3fc8cb44f1ce614",
        "id": "provider-profile.azure.baseline",
        "version": "1"
      },
      "region": "westeurope",
      "required": true,
      "responsibility_id": "responsibility.storage",
      "service_id": "azure.cool-storage"
    },
    {
      "assignment_id": "assignment.hot-storage",
      "capability_evidence": [
        "capability.hot-storage"
      ],
      "cost_contribution": {
        "currency": "USD",
        "monthly_amount": "1"
      },
      "deployment_component_id": "deployment.azure.hot-storage",
      "deployment_component_version": "1",
      "deployment_specification_component_ids": [
        "l3_hot.azure.cosmos_db",
        "l3_hot.azure.function_plan"
      ],
      "formula_refs": [
        "formula.hot-storage"
      ],
      "logical_component_id": "component.hot-storage",
      "pricing_model_refs": [
        "pricing.azure.hot-storage"
      ],
      "provider": "azure",
      "provider_implementation_profile_ref": {
        "digest": "sha256:2ba5943a139f846d25e2f4974051fa20775b6a096beda87fd3fc8cb44f1ce614",
        "id": "provider-profile.azure.baseline",
        "version": "1"
      },
      "region": "westeurope",
      "required": true,
      "responsibility_id": "responsibility.storage",
      "service_id": "azure.hot-storage"
    },
    {
      "assignment_id": "assignment.ingestion",
      "capability_evidence": [
        "capability.ingestion"
      ],
      "cost_contribution": {
        "currency": "USD",
        "monthly_amount": "1"
      },
      "deployment_component_id": "deployment.aws.ingestion",
      "deployment_component_version": "1",
      "deployment_specification_component_ids": [
        "l1.aws.dispatcher_lambda",
        "l1.aws.iot_core"
      ],
      "formula_refs": [
        "formula.ingestion"
      ],
      "logical_component_id": "component.ingestion",
      "pricing_model_refs": [
        "pricing.aws.ingestion"
      ],
      "provider": "aws",
      "provider_implementation_profile_ref": {
        "digest": "sha256:ca59551b7a6240a31fe400853d4761d12650ca1a6e28cedd0b6bc3cc8af49a77",
        "id": "provider-profile.aws.baseline",
        "version": "1"
      },
      "region": "eu-central-1",
      "required": true,
      "responsibility_id": "responsibility.ingestion",
      "service_id": "aws.ingestion"
    },
    {
      "assignment_id": "assignment.processing",
      "capability_evidence": [
        "capability.processing"
      ],
      "cost_contribution": {
        "currency": "USD",
        "monthly_amount": "1"
      },
      "deployment_component_id": "deployment.azure.processing",
      "deployment_component_version": "1",
      "deployment_specification_component_ids": [
        "l2.azure.event_grid",
        "l2.azure.function_plan",
        "l2.azure.logic_apps"
      ],
      "formula_refs": [
        "formula.processing"
      ],
      "logical_component_id": "component.processing",
      "pricing_model_refs": [
        "pricing.azure.processing"
      ],
      "provider": "azure",
      "provider_implementation_profile_ref": {
        "digest": "sha256:2ba5943a139f846d25e2f4974051fa20775b6a096beda87fd3fc8cb44f1ce614",
        "id": "provider-profile.azure.baseline",
        "version": "1"
      },
      "region": "westeurope",
      "required": true,
      "responsibility_id": "responsibility.processing",
      "service_id": "azure.processing"
    },
    {
      "assignment_id": "assignment.twin-state",
      "capability_evidence": [
        "capability.twin-state"
      ],
      "cost_contribution": {
        "currency": "USD",
        "monthly_amount": "1"
      },
      "deployment_component_id": "deployment.azure.twin-state",
      "deployment_component_version": "1",
      "deployment_specification_component_ids": [
        "l4.azure.digital_twins",
        "l4.azure.pusher_function"
      ],
      "formula_refs": [
        "formula.twin-state"
      ],
      "logical_component_id": "component.twin-state",
      "pricing_model_refs": [
        "pricing.azure.twin-state"
      ],
      "provider": "azure",
      "provider_implementation_profile_ref": {
        "digest": "sha256:2ba5943a139f846d25e2f4974051fa20775b6a096beda87fd3fc8cb44f1ce614",
        "id": "provider-profile.azure.baseline",
        "version": "1"
      },
      "region": "westeurope",
      "required": true,
      "responsibility_id": "responsibility.twin-state",
      "service_id": "azure.twin-state"
    },
    {
      "assignment_id": "assignment.visualization",
      "capability_evidence": [
        "capability.visualization"
      ],
      "cost_contribution": {
        "currency": "USD",
        "monthly_amount": "1"
      },
      "deployment_component_id": "deployment.azure.visualization",
      "deployment_component_version": "1",
      "deployment_specification_component_ids": [
        "l5.azure.managed_grafana"
      ],
      "formula_refs": [
        "formula.visualization"
      ],
      "logical_component_id": "component.visualization",
      "pricing_model_refs": [
        "pricing.azure.visualization"
      ],
      "provider": "azure",
      "provider_implementation_profile_ref": {
        "digest": "sha256:2ba5943a139f846d25e2f4974051fa20775b6a096beda87fd3fc8cb44f1ce614",
        "id": "provider-profile.azure.baseline",
        "version": "1"
      },
      "region": "westeurope",
      "required": true,
      "responsibility_id": "responsibility.visualization",
      "service_id": "azure.visualization"
    }
  ],
  "content_digest": "sha256:537be780bd9eb3e1c3657262a74b2127ffc64db23c6fffe0747d640ec57efee8",
  "cost_summary": {
    "component_totals": [
      {
        "item_id": "component.ingestion",
        "monthly_amount": "1"
      },
      {
        "item_id": "component.processing",
        "monthly_amount": "1"
      },
      {
        "item_id": "component.hot-storage",
        "monthly_amount": "1"
      },
      {
        "item_id": "component.cool-storage",
        "monthly_amount": "1"
      },
      {
        "item_id": "component.archive-storage",
        "monthly_amount": "1"
      },
      {
        "item_id": "component.twin-state",
        "monthly_amount": "1"
      },
      {
        "item_id": "component.visualization",
        "monthly_amount": "1"
      }
    ],
    "currency": "USD",
    "edge_totals": [
      {
        "item_id": "edge.ingestion-to-processing",
        "monthly_amount": "0.1"
      },
      {
        "item_id": "edge.processing-to-hot-storage",
        "monthly_amount": "0.1"
      },
      {
        "item_id": "edge.hot-to-cool-storage",
        "monthly_amount": "0.1"
      },
      {
        "item_id": "edge.cool-to-archive-storage",
        "monthly_amount": "0.1"
      },
      {
        "item_id": "edge.hot-storage-to-twin-state",
        "monthly_amount": "0.1"
      },
      {
        "item_id": "edge.twin-state-to-visualization",
        "monthly_amount": "0.1"
      }
    ],
    "monthly_total": "7.6",
    "responsibility_totals": [
      {
        "item_id": "responsibility.ingestion",
        "monthly_amount": "1"
      },
      {
        "item_id": "responsibility.processing",
        "monthly_amount": "1"
      },
      {
        "item_id": "responsibility.storage",
        "monthly_amount": "3"
      },
      {
        "item_id": "responsibility.twin-state",
        "monthly_amount": "1"
      },
      {
        "item_id": "responsibility.visualization",
        "monthly_amount": "1"
      }
    ]
  },
  "deployment_specification_ref": {
    "calculation_run_id": "018f0f5e-7b5e-7b2d-9f0b-7f66c2a88a01",
    "digest": "sha256:564cc36f02af12b7e2833ab0c679ecf295e820f700021000c906eb5eb8609bc4",
    "schema_version": "resolved-deployment-specification.v1"
  },
  "extension_bindings": [
    {
      "artifact_digest": "sha256:cd6107c2e04d7004ff8ade6c6c82f2e0272264dc556e05b46a00fd47269e8fef",